{
  "robot_id": "rover-01",
  "action": "move",
  "source": "autonomy_planner",
  "linear_x": 0.4,
  "angular_z": 0.0,
  "zone": "normal",
  "human_nearby": false,
  "mission_id": "mission-demo-001",
  "position": { "x": 2.5, "y": 1.0, "heading": 0.0 },
  "timestamp": 1719360000.0,
  "nonce": "a1b2c3d4e5f6g7h8",
  "policy_epoch": 1
}
